Course Name,University,University Type,Degree Type,Duration,Language,Course Code,Course Area,Website
Ancient Civilizations for the Contemporary World,University of Milan,Public,Bachelors,3,EN,L-1,Cultural heritage,https://ancient-civilization.cdl.unimi.it/en
Animal care,University of Padua,Public,Bachelors,3,EN,L-38 R,Zootechnical sciences and animal production technologies,https://www.unipd.it/offerta-didattica/corso-di-laurea/agraria-e-medicina-veterinaria?tipo=L&scuola=AV&ordinamento=2025&key=AV2874&cg=medicina-veterinaria-e-benesse
Applied Computer Science and Artificial Intelligence,"University of Rome ""La Sapienza""",Public,Bachelors,3,EN,L-31 R,Computer Science and Technology,https://corsidilaurea.uniroma1.it/it/course/33502
Architecture Sciences for Heritage,Polytechnic University of Bari,Public,Bachelors,3,EN,L-17 R,Architectural Sciences,https://poliba.coursecatalogue.cineca.it/corsi/2025/10246
Artificial intelligence,University of Pavia,Public,Bachelors,3,EN,L-31 R,Computer Science and Technology,https://matematica.unipv.it/laurea-triennale-ia/
Bioinformatics,"University of Rome ""La Sapienza""",Public,Bachelors,3,EN,L-2 R,Biotechnology,https://corsidilaurea.uniroma1.it/it/course/33455
Biology for One-health,University of Naples Federico II,Public,Bachelors,3,EN,L-13 R,Biological Sciences,http://www.dipartimentodibiologia.unina.it/
Biology of Human and Environmental Health,University of Padua,Public,Bachelors,3,EN,L-13 R,Biological Sciences,https://www.unipd.it/offerta-didattica/corso-di-laurea/scienze?tipo=L&scuola=SC&ordinamento=2025&key=SC2978&cg=scienze
Biosciences and Biotechnology,University of Camerino,Public,Bachelors,3,EN,L-2 R,Biotechnology,https://didattica.unicam.it/Guide/PaginaCorso.do?corso_id=10014
Biotech Engineering For Health,University of Siena,Public,Bachelors,3,EN,L-2 R,Biotechnology,https://biotech-engineering.unisi.it/it
Biotechnology,University of Teramo,Public,Bachelors,3,EN,L-2 R,Biotechnology,https://www.unite.it/UniTE/Didattica/Corsi_di_studio/Biotechnology_L_2
Building Construction Engineering,Alma Mater Studiorum - University of Bologna,Public,Bachelors,3,EN,L-23 R,Building sciences and techniques,https://corsi.unibo.it/1cycle/Building
BUSINESS & MANAGEMENT,University of Turin,Public,Bachelors,3,EN,L-18 R,Economics and Business Management Sciences,http://www.business-management.unito.it
Business Administration & Economics,"University of Rome ""Tor Vergata""",Public,Bachelors,3,EN,L-18 R,Economics and Business Management Sciences,http://economia.uniroma2.it/ba/business-administration-economics/
Business Administration and Management,Ca' Foscari University of Venice,Public,Bachelors,3,EN,L-18 R,Economics and Business Management Sciences,https://unive.it/cdl/ETR8
Business and Economics,University of Brescia,Public,Bachelors,3,EN,L-18 R,Economics and Business Management Sciences,https://permalink.unibs.it/suacds/2025/54456R/infogen
Business and Economics,Alma Mater Studiorum - University of Bologna,Public,Bachelors,3,EN,L-18 R,Economics and Business Management Sciences,http://corsi.unibo.it/CLaBE
Civil and Environmental Engineering,Polytechnic University of Turin,Public,Bachelors,3,EN,L-7 R,Civil and environmental engineering,https://www.polito.it/corsi/32-465
Civil and environmental engineering,University of Naples Federico II,Public,Bachelors,3,EN,L-7 R,Civil and environmental engineering,https://www.civil-environmental.unina.it
Classics,"University of Rome ""La Sapienza""",Public,Bachelors,3,EN,L-10 R,Letters,https://corsidilaurea.uniroma1.it/it/course/33528
Data Analytics,"University of Campania ""Luigi Vanvitelli""",Public,Bachelors,3,EN,L-41 R,Statistics,http://www.matfis.unicampania.it/didattica/corsi-di-studio/data-analytics
Dental Hygiene,University of Parma,Public,Bachelors,3,EN,L/SNT3,Technical health professions,https://corsi.unipr.it/cdl-dh
Digital Economics and Business,Polytechnic University of Marche,Public,Bachelors,3,EN,L-33 R,Economic Sciences,https://www.econ.univpm.it/ET07
Digital Management,Ca' Foscari University of Venice,Public,Bachelors,3,EN,L-18 R,Economics and Business Management Sciences,http://www.unive.it/cdl/etr7
Earth and climate dynamics,University of Padua,Public,Bachelors,3,EN,L-34 R,Geological sciences,https://www.unipd.it/offerta-didattica/corso-di-laurea/scienze?tipo=L&scuola=SC&ordinamento=2025&key=SC2986&cg=scienze
Earth Sciences for Sustainable Development,University of Trieste,Public,Bachelors,3,EN,L-34 R,Geological sciences,https://degree.units.it/en/0320107323400001
Earth System and Global Changes,University of Bari Aldo Moro,Public,Bachelors,3,EN,L-34 R,Geological sciences,http://www.scienzegeologiche.uniba.it/77-presentazione-corsi/
Economics and Business,Ca' Foscari University of Venice,Public,Bachelors,3,EN,L-33 R,Economic Sciences,https://unive.it/cdl/ETR9
Economics and Finance,Alma Mater Studiorum - University of Bologna,Public,Bachelors,3,EN,L-33 R,Economic Sciences,http://corsi.unibo.it/1cycle/EconomicsFinance
ECONOMICS AND FINANCE WITH DATA SCIENCE,University of Turin,Public,Bachelors,3,EN,L-33 R,Economic Sciences,https://www.efds.unito.it/do/home.pl
Economics and Management,University of Siena,Public,Bachelors,3,EN,L-18 R,Economics and Business Management Sciences,https://economics-management.unisi.it/en
ECONOMICS AND SCIENCE FOR ENVIRONMENTAL SUSTAINABILITY,University of Milan-Bicocca,Public,Bachelors,3,EN,L-33 R,Economic Sciences,https://www.unimib.it/didattica/offerta-formativa/corsi-laurea-iscrizioni/area-economico-statistica-laurea-triennale
Economics of Tourism and Cities,Alma Mater Studiorum - University of Bologna,Public,Bachelors,3,EN,L-33 R,Economic Sciences,https://corsi.unibo.it/1cycle/clet
Economics with data science,University of Cassino and Southern Lazio,Public,Bachelors,3,EN,L-33 R,Economic Sciences,https://unicas-public.gomp.it/PublicData?uid=539e3281-7a03-4c3a-914a-8305223bec11&mode=CourseDetail&iso=eng&academicYear=2024
"Economics, Politics and Social Sciences",Alma Mater Studiorum - University of Bologna,Public,Bachelors,3,EN,L-33 R,Economic Sciences,https://corsi.unibo.it/1cycle/EconomicsPoliticsSocialSciences
"Economics: Behavior, Data and Policy",University of Milan,Public,Bachelors,3,EN,L-33 R,Economic Sciences,https://econ.cdl.unimi.it/en
Electronic and Communications Engineering,Polytechnic University of Turin,Public,Bachelors,3,EN,L-8 R,Information Engineering,https://www.polito.it/corsi/37-474
Engineering management,University of Perugia,Public,Bachelors,3,EN,L-8 R,Information Engineering,http://www.unipg.it/perm/offerta-formativa/2025/corso/8432
Engineering Sciences,"University of Rome ""Tor Vergata""",Public,Bachelors,3,EN,L-9 R,Industrial Engineering,http://www.engineering-sciences.uniroma2.it/
ENVIRONMENTAL SCIENCES AND CIVIL PROTECTION,Polytechnic University of Marche,Public,Bachelors,3,EN,L-32 R,Science and technology for the environment and nature,https://www.disva.univpm.it/content/Undergraduate_Course_in_Environmental_Sciences_and_Civil_Protection
European Studies,Alma Mater Studiorum - University of Bologna,Public,Bachelors,3,EN,L-36 R,Political Science and International Relations,https://corsi.unibo.it/1cycle/EuropeanStudies
Genomics,Alma Mater Studiorum - University of Bologna,Public,Bachelors,3,EN,L-2 R,Biotechnology,http://corsi.unibo.it/1Cycle/Genomics
GEOLOGY,University of PISA,Public,Bachelors,3,EN,L-34 R,Geological sciences,https://www.dst.unipi.it/geology-uzbk.html
Global Governance,"University of Rome ""Tor Vergata""",Public,Bachelors,3,EN,L-16 R,Administrative and organizational sciences,http://www.globalgovernance.it
Global Humanities,"University of Rome ""La Sapienza""",Public,Bachelors,3,EN,L-42 R,History,https://corsidilaurea.uniroma1.it/it/course/33537
Global Law and Transnational Legal Studies,University of Turin,Public,Bachelors,3,EN,L-14 R,Legal Services Sciences,https://www.globallaw.unito.it/do/home.pl
Global Studies for Sustainable Local and International Development and Cooperation,University of Parma,Public,Bachelors,3,EN,L-37 R,"Social Sciences for Cooperation, Development and Peace",https://corsi.unipr.it/en/scheda/cdl-globals
Hospitality Innovation and e-Tourism,Ca' Foscari University of Venice,Public,Bachelors,3,EN,L-15 R,Tourism Sciences,http://www.unive.it/cdl/ctr9
Industrial Engineering Technology,University of Cassino and Southern Lazio,Public,Bachelors,3,EN,L-9 R,Industrial Engineering,https://unicas-public.gomp.it/PublicData?mode=classRoomList&academicYear=2023&iso=ita
Information Engineering,University of Padua,Public,Bachelors,3,EN,L-8 R,Information Engineering,https://www.unipd.it/offerta-didattica/corso-di-laurea/ingegneria?tipo=L&scuola=IN&ordinamento=2024&key=IN2801&cg=ingegneria
Interaction Design,Polytechnic University of Milan,Public,Bachelors,3,EN,L-4 R,Industrial design,https://www.design.polimi.it/it
"International Politics, Law and Economics",University of Milan,Public,Bachelors,3,EN,L-36 R,Political Science and International Relations,https://iple.cdl.unimi.it/en
International studies,Alma Mater Studiorum - University of Bologna,Public,Bachelors,3,EN,L-36 R,Political Science and International Relations,https://corsi.unibo.it/1cycle/InternationalStudies
"International, European and Comparative Legal Studies (IECoLS)",University of Macerata,Public,Bachelors,3,EN,L-14 R,Legal Services Sciences,https://corsi.unimc.it/en/iecols
Management & Business Analytics,University of UDINE,Public,Bachelors,3,EN,L-18 R,Economics and Business Management Sciences,https://www.uniud.it/it/didattica/corsi/area-economico-giuridica/economia/laurea/management-business-analytics
Management and Economics,Alma Mater Studiorum - University of Bologna,Public,Bachelors,3,EN,L-18 R,Economics and Business Management Sciences,https://corsi.unibo.it/1cycle/Management
Management Engineering for Innovation,Polytechnic University of Bari,Public,Bachelors,3,EN,L-9 R,Industrial Engineering,https://poliba.coursecatalogue.cineca.it/corsi/2025/10247
MANAGEMENT FOR BUSINESS AND ECONOMICS,University of PISA,Public,Bachelors,3,EN,L-18 R,Economics and Business Management Sciences,https://mbe.ec.unipi.it/
Marine Biology and Blue Biotechnologies,University of Messina,Public,Bachelors,3,EN,L-13 R,Biological Sciences,https://marine-biology-and-blue-biotechnologies.cdl.unime.it/it
Maritime Science and Technology,University of Genoa,Public,Bachelors,3,EN,L-28 R,Navigation Sciences and Technologies,https://corsi.unige.it/corsi/11929
"Molecular Biology, Medicinal Chemistry and Computer Science for Pharmaceutical Applications","University of Rome ""La Sapienza""",Public,Bachelors,3,EN,L-29 R,Pharmaceutical Sciences and Technologies,https://corsidilaurea.uniroma1.it/it/course/33457
Nursing,University of Palermo,Public,Bachelors,3,EN,L/SNT1,"Health professions, nursing and midwifery",https://www.unipa.it/dipartimenti/promise/cds/nursing2233
Nursing,"University of Campania ""Luigi Vanvitelli""",Public,Bachelors,3,EN,L/SNT1,"Health professions, nursing and midwifery",http://www.scienzemedichetraslazionali.unicampania.it
Nursing,"University of Rome ""La Sapienza""",Public,Bachelors,3,EN,L/SNT1,"Health professions, nursing and midwifery",https://corsidilaurea.uniroma1.it/it/course/28614
"Philosophy, International and Economic Studies",Ca' Foscari University of Venice,Public,Bachelors,3,EN,L-5 R,Philosophy,http://www.unive.it/cdl/ltr6
PHYSICAL SCIENCES FOR INNOVATIVE TECHNOLOGIES,University of Milan-Bicocca,Public,Bachelors,3,EN,L-30 R,Physical Sciences and Technologies,https://elearning.unimib.it/E3004Q
Psychological Science,University of Padua,Public,Bachelors,3,EN,L-24 R,Psychological sciences and techniques,https://www.unipd.it/offerta-didattica/corso-di-laurea/psicologia?tipo=L&scuola=PS&ordinamento=2025&key=PS2959&cg=psicologia
Social sciences for global challenges,University of Pavia,Public,Bachelors,3,EN,L-16 R,Administrative and organizational sciences,https://socialsciences.cdl.unipv.it/en
"Comparative, European and International Legal Studies",University of Trento,Public,Bachelors,3,EN,L-14 R,Legal Services Sciences,https://corsi.unitn.it/en/comparative-european-and-international-legal-studies
Sustainable Blue Economy,"University of Naples ""Parthenope""",Public,Bachelors,3,EN,L-21 R,"Territorial, urban, landscape and environmental planning sciences",https://international.uniparthenope.it/all-courses/sustainable-blue-economy-sea-blue/
Sustainable Building Engineering,"University of Rome ""La Sapienza""",Public,Bachelors,3,EN,L-23 R,Building sciences and techniques,https://corsidilaurea.uniroma1.it/it/course/33482
Sustainable Business for Societal Challenges,University of Florence,Public,Bachelors,3,EN,L-18 R,Economics and Business Management Sciences,https://www.susbus.unifi.it/
Techniques and methods in psychological science,University of Padua,Public,Bachelors,3,EN,L-24 R,Psychological sciences and techniques,https://www.unipd.it/offerta-didattica/corso-di-laurea/psicologia?tipo=L&scuola=PS&ordinamento=2025&key=PS2964&cg=psicologia
Transnational and European Legal Studies,University of Messina,Public,Bachelors,3,EN,L-14 R,Legal Services Sciences,https://unime.coursecatalogue.cineca.it/corsi/2024/10619?annoOrdinamento=2024
Accounting and Financial Management,Bocconi University of Milan,Public,Masters,2,EN,LM-77 R,Business and Economics,https://www.unibocconi.it/en/programs/master-science/accounting-and-financial-management
"Accounting, Governance and Sustainability",University of Bergamo,Public,Masters,2,EN,LM-77 R,Business and Economics,https://ls-ags.unibg.it/en
Advanced Automotive Engineering,University of Modena and Reggio Emilia,Public,Masters,2,EN,LM-33,Mechanical Engineering,https://www.ingmo.unimore.it/it/didattica/corsi-di-laurea-magistrale-informazioni-generali/advanced-automotive-engineering-english
Advanced Biotechnology,University of Cagliari,Public,Masters,2,EN,LM-9 R,"Medical, veterinary and pharmaceutical biotechnology",https://web.unica.it/unica/it/crs_60_80.page
Advanced Cosmetic Sciences,Alma Mater Studiorum - University of Bologna,Public,Masters,2,EN,LM-54 R,Chemical Sciences,http://corsi.unibo.it/2Cycle/AdvancedCosmeticSciences
Advanced Materials Science and Technology,University of Genoa,Public,Masters,2,EN,LM Sc. Mat.,Materials Sciences,https://corsi.unige.it/corsi/11967
Advanced Methods in Particle Physics,Alma Mater Studiorum - University of Bologna,Public,Masters,2,EN,LM-17 R,Physics,https://corsi.unibo.it/2cycle/ParticlePhysics
ADVANCED MOLECULAR SCIENCES,University of Florence,Public,Masters,2,EN,LM-54 R,Chemical Sciences,http://www.master-ams.unifi.it
Advanced Molecular Sciences for Health Products,University of Parma,Public,Masters,2,EN,LM-54 R,Chemical Sciences,https://corsi.unipr.it/en/cdlm-amshp
Advanced spectroscopy in chemistry,Alma Mater Studiorum - University of Bologna,Public,Masters,2,EN,LM-71 R,Industrial Chemistry Sciences and Technologies,https://corsi.unibo.it/2cycle/AdvancedSpectroscopyChemistry
Aeronautical Engineering,Polytechnic University of Milan,Public,Masters,2,EN,LM-20 R,Aerospace and Astronautical Engineering,https://ccs-aerospaziale.polimi.it/corso-di-laurea-magistrale-in-ingegneria-aeronautica/
Aerospace Engineering,University of Padua,Public,Masters,2,EN,LM-20 R,Aerospace and Astronautical Engineering,https://www.unipd.it/offerta-didattica/corso-di-laurea-magistrale/ingegneria?ordinamento=2025&key=IN2921&tipo=LM&scuola=IN
Aerospace Engineering,Alma Mater Studiorum - University of Bologna,Public,Masters,2,EN,LM-20 R,Aerospace and Astronautical Engineering,http://corsi.unibo.it/2cycle/AerospaceEngineering
Agri-food sustainability,University of Pavia,Public,Masters,2,EN,LM-69 R,Agricultural sciences and technologies,https://agrifood.cdl.unipv.it/it
AGRICULTURAL AND ENVIRONMENTAL BIOTECHNOLOGY,University of Perugia,Public,Masters,2,EN,LM-7 R,Agricultural biotechnology,http://www.unipg.it/perm/offerta-formativa/2025/corso/7628
Agricultural Engineering,Polytechnic University of Milan,Public,Masters,2,EN,LM-26 R,Safety Engineering,https://www.ccsage.polimi.it/
Agricultural science and technology,University of Catania,Public,Masters,2,EN,LM-69 R,Agricultural sciences and technologies,https://www.di3a.unict.it/corsi/lm-69-eng
Agrifood Innovation Management,University of Trento,Public,Masters,2,EN,LM-69 R,Agricultural sciences and technologies,https://corsi.unitn.it/en/agrifood-innovation-management
AgriTech Engineering,Polytechnic University of Turin,Public,Masters,2,EN,LM-26 R,Safety Engineering,https://www.polito.it/corsi/32-457
Analytics and Data Science for Economics and Management,University of Brescia,Public,Masters,2,EN,LM-Data,Data science,https://permalink.unibs.it/suacds/2025/54477R/infogen
Applied Child and Adolescent Psychology,University of Padua,Public,Masters,2,EN,LM-51 R,Psychology,https://www.unipd.it/offerta-didattica/corso-di-laurea-magistrale/psicologia?tipo=LM&scuola=PS&ordinamento=2025&key=PS3049&cg=psicologia
Applied Dynamic and Clinical Psychology,"University of Rome ""La Sapienza""",Public,Masters,2,EN,LM-51 R,Psychology,https://corsidilaurea.uniroma1.it/it/course/33573
Applied Economics,University of Padua,Public,Masters,2,EN,LM-56 R,Economic Sciences,https://www.unipd.it/offerta-didattica/corso-di-laurea-magistrale/economia-e-scienze-politiche?tipo=LM&scuola=EP&ordinamento=2025&key=EP2895&cg=economia-finanza-gestione-azie
Applied Economics and Markets,Alma Mater Studiorum - University of Bologna,Public,Masters,2,EN,LM-56 R,Economic Sciences,http://corsi.unibo.it/Magistrale/EconomiaPoliticaEconomica
Applied experimental psychological sciences,University of Milan-Bicocca,Public,Masters,2,EN,LM-51 R,Psychology,http://didattica.unimib.it/F5109P
Applied Mathematics,University of Siena,Public,Masters,2,EN,LM-40 R,Mathematics,https://applied-mathematics.unisi.it/it
Archaeological Materials Science,"University of Rome ""La Sapienza""",Public,Masters,2,EN,LM-11 R,Sciences for the conservation of cultural heritage,https://corsidilaurea.uniroma1.it/it/course/33600
Architectural composition,University of Genoa,Public,Masters,2,EN,LM-4 R,Architecture and civil engineering-architecture,https://corsi.unige.it/en/corsi/11930
Architectural Design and History,Polytechnic University of Milan,Public,Masters,2,EN,LM-4 R,Architecture and civil engineering-architecture,http://www.adh.mantova.polimi.it
Architectural Engineering,Polytechnic University of Milan,Public,Masters,2,EN,LM-24,Building Systems Engineering,https://www.auic.polimi.it/it
Architecture,IUAV University of Venice,Public,Masters,2,EN,LM-4 R,Architecture and civil engineering-architecture,https://www.iuav.it/it/didattica/lauree-magistrali/ma-architecture
Architecture and creative practices for the city and landscape,Alma Mater Studiorum - University of Bologna,Public,Masters,2,EN,LM-4 R,Architecture and civil engineering-architecture,https://corsi.unibo.it/2cycle/ArchitectureCreativePractices
ARCHITECTURE AND HERITAGE,University of Naples Federico II,Public,Masters,2,EN,LM-4 R,Architecture and civil engineering-architecture,https://www.diarc.archer.unina.it/
Architecture - Regeneration of Built Environment,"University of Campania ""Luigi Vanvitelli""",Public,Masters,2,EN,LM-4 R,Architecture and civil engineering-architecture,https://www.architettura.unicampania.it/didattica/corsi-di-studio/magistrale-in-architettura-rigenerazione-dell-ambiente-costruito-in-lingua-inglese
Archival science and AI,University of TUSCIA,Public,Masters,2,EN,LM-5 R,Archival and library science,
AREA & GLOBAL STUDIES FOR INTERNATIONAL COOPERATION,University of Turin,Public,Masters,2,EN,LM-81 R,Sciences for Development Cooperation,http://www.agic.unito.it/
"Art History in Rome, from Late Antiquity to the Present","University of Rome ""Tor Vergata""",Public,Masters,2,EN,LM-89 R,History of art,http://arthistoryrome.uniroma2.it/
Artificial Intelligence,"University of Rome ""La Sapienza""",Public,Masters,2,EN,LM-32,Computer Engineering,https://corsidilaurea.uniroma1.it/it/course/33513
Artificial intelligence,University of Verona,Public,Masters,2,EN,LM-18,Informatics,https://www.corsi.univr.it/?ent=cs&id=1355
Artificial Intelligence,Alma Mater Studiorum - University of Bologna,Public,Masters,2,EN,LM-18,Informatics,https://corsi.unibo.it/2cycle/artificial-intelligence
Artificial Intelligence & Cybersecurity,University of UDINE,Public,Masters,2,EN,LM-18,Informatics,https://www.uniud.it/it/didattica/corsi/area-scientifica/scienze-matematiche-informatiche-multimediali-fisiche/laurea-magistrale/artificial-intelligence-cybersecurity
Artificial Intelligence and Automation Engineering,University of Siena,Public,Masters,2,EN,LM-32,Computer Engineering,https://artificial-intelligence-automation.unisi.it/
ARTIFICIAL INTELLIGENCE AND COMPUTER SCIENCE,University of Calabria,Public,Masters,2,EN,LM-18,Informatics,https://corsi.unical.it/lm/artificial-intelligence-and-computer-science/
ARTIFICIAL INTELLIGENCE AND DATA ENGINEERING,University of PISA,Public,Masters,2,EN,LM-32,Computer Engineering,https://computer.ing.unipi.it/aide-lm
Artificial Intelligence and Robotics,"University of Rome ""La Sapienza""",Public,Masters,2,EN,LM-32,Computer Engineering,https://corsidilaurea.uniroma1.it/it/course/33514
Artificial Intelligence Engineering,University of Modena and Reggio Emilia,Public,Masters,2,EN,LM-32,Computer Engineering,https://www.ingmo.unimore.it/it/didattica/corsi-di-laurea-magistrale-informazioni-generali/artificial-intelligence-engineering
ARTIFICIAL INTELLIGENCE FOR BIOMEDICINE AND HEALTHCARE,University of Turin,Public,Masters,2,EN,LM-91 R,Techniques and methods for the digital society,http://www.aibh.unito.it
ARTIFICIAL INTELLIGENCE FOR SCIENCE AND TECHNOLOGY,University of Milan-Bicocca,Public,Masters,2,EN,LM-91 R,Techniques and methods for the digital society,https://elearning.unimib.it/course/index.php?categoryid=9164
Artificial Intelligence Systems,University of Trento,Public,Masters,2,EN,LM-32,Computer Engineering,https://corsi.unitn.it/en/artificial-intelligence-systems
Astrophysics and cosmology,University of Padua,Public,Masters,2,EN,LM-17 R,Physics,https://www.unipd.it/offerta-didattica/corso-di-laurea-magistrale/scienze?tipo=LM&scuola=SC&ordinamento=2025&key=SC2996&cg=scienze
Astrophysics and cosmology,Alma Mater Studiorum - University of Bologna,Public,Masters,2,EN,LM-58 R,Science of the Universe,https://corsi.unibo.it/2cycle/Astrophysics
Astrophysics and Cosmology,"University of Rome ""La Sapienza""",Public,Masters,2,EN,LM-58 R,Science of the Universe,https://corsidilaurea.uniroma1.it/it/course/33607
ASTROPHYSICS AND SPACE PHYSICS,University of Milan-Bicocca,Public,Masters,2,EN,LM-58 R,Science of the Universe,https://www.fisica.unimib.it/it/didattica/corsi-studio#main-content
Astrophysics and Space Science,"University of Rome ""Tor Vergata""",Public,Masters,2,EN,LM-58 R,Science of the Universe,https://www.master-mass.eu/
Atmospheric Science and Technology for Meteorology and Climate,University of L'Aquila,Public,Masters,2,EN,LM-17 R,Physics,https://dsfc.univaq.it/it/degree-program.html
Health and Physical Activity,"University of Rome ""Foro Italico""",Public,Masters,2,EN,LM-67 R,Science and techniques of preventive and adapted motor activities,https://www.uniroma4.it/index.php/corsi/laurea-magistrale-in-attivita-fisica-e-salute-classe-lm67int/
Automation and Control Engineering,Polytechnic University of Milan,Public,Masters,2,EN,LM-25,Automation Engineering,https://www.ccsatm.polimi.it/?lang=en
Automation and Robotics Engineering,Polytechnic University of Bari,Public,Masters,2,EN,LM-25,Automation Engineering,https://poliba.coursecatalogue.cineca.it/corsi/2025/10264
Automation Engineering,Alma Mater Studiorum - University of Bologna,Public,Masters,2,EN,LM-25,Automation Engineering,http://corsi.unibo.it/2Cycle/AutomationEngineering
Automation Engineering and Control of Complex Systems,University of Catania,Public,Masters,2,EN,LM-25,Automation Engineering,http://www.dieei.unict.it/corsi/lm-25
Automotive Engineering,Polytechnic University of Turin,Public,Masters,2,EN,LM-33,Mechanical Engineering,https://www.polito.it/corsi/32-464
Autonomous Vehicle Engineering,University of Naples Federico II,Public,Masters,2,EN,LM-33,Mechanical Engineering,
Biochemistry,"University of Rome ""La Sapienza""",Public,Masters,2,EN,LM-9 R,"Medical, veterinary and pharmaceutical biotechnology",https://corsidilaurea.uniroma1.it/it/course/33459
"Biodiversity, Conservation and Environmental Quality",University of Siena,Public,Masters,2,EN,LM-6 R,Biology,https://bceq.unisi.it/en
Bioengineering,University of Genoa,Public,Masters,2,EN,LM-21 R,Biomedical Engineering,https://corsi.unige.it/en/corsi/11933
Bioengineering for Personalized Medicine,University of Trento,Public,Masters,2,EN,LM-21 R,Biomedical Engineering,https://corsi.unitn.it/it/bioengineering-personalized-medicine
Bioinformatics,Alma Mater Studiorum - University of Bologna,Public,Masters,2,EN,LM-6 R,Biology,http://corsi.unibo.it/2Cycle/Bioinformatics
Bioinformatics for Computational Genomics,University of Milan,Public,Masters,2,EN,LM-8 R,Industrial biotechnology,https://bcg.cdl.unimi.it/en
Quantitative and Computational Biology,University of Trento,Public,Masters,2,EN,LM-8 R,Industrial biotechnology,https://corsi.unitn.it/en/quantitative-and-computational-biology
Biology for Translational Research and Precision Medicine,University of Verona,Public,Masters,2,EN,LM-6 R,Biology,https://www.corsi.univr.it/?ent=cs&id=1337
BIOLOGY OF EXTREME ENVIRONMENTS,University of Naples Federico II,Public,Masters,2,EN,LM-6 R,Biology,https://www.dipartimentodibiologia.unina.it/corsi-di-laurea/biology-extreme-environments/
Ingegneria Biomedica,Polytechnic University of Marche,Public,Masters,2,EN,LM-21 R,Biomedical Engineering,https://www.ingegneria.univpm.it/offerta-formativa-2025
Biomedical Engineering,Alma Mater Studiorum - University of Bologna,Public,Masters,2,EN,LM-21 R,Biomedical Engineering,https://corsi.unibo.it/2cycle/BiomedicalEngineering/index.html
