Course Name,University,University Type,Degree Type,Duration,Language,Course Code,Course Area,Website
Specialized translation,Alma Mater Studiorum - University of Bologna,Public,Masters,2,EN,LM-94 R,Specialized translation and interpreting,http://corsi.unibo.it/2cycle/SpecializedTranslation
Sport and Health Promotion,"University of Rome ""Tor Vergata""",Public,Masters,2,EN,LM-68 R,Sports Sciences and Techniques,http://www.pahp.med.uniroma2.it
Statistical Methods and Applications,"University of Rome ""La Sapienza""",Public,Masters,2,EN,LM-82 R,Statistical Sciences,https://corsidilaurea.uniroma1.it/it/course/33517
Statistical Sciences,Alma Mater Studiorum - University of Bologna,Public,Masters,2,EN,LM-82 R,Statistical Sciences,http://corsi.unibo.it/2Cycle/StatisticalSciences
STOCHASTICS AND DATA SCIENCE,University of Turin,Public,Masters,2,EN,LM-40 R,Mathematics,http://www.master-sds.unito.it
International Studies,University of Rome Three,Public,Masters,2,EN,LM-52 R,International Relations,https://scienzepolitiche.uniroma3.it/corsi/dipartimento-di-scienze-politiche/lm/2020-2021/international-studies-0580707305300003/
International Security Studies,University of Trento,Public,Masters,2,EN,LM-52 R,International Relations,https://corsi.unitn.it/en/international-security-studies
Sustainable agriculture,University of Padua,Public,Masters,2,EN,LM-69 R,Agricultural sciences and technologies,https://www.unipd.it/offerta-didattica/corso-di-laurea-magistrale/agraria-e-medicina-veterinaria?tipo=LM&scuola=AV&ordinamento=2025&key=AV2881&cg=scienze-agrarie-forestali-e-al
Sustainable and Resilient Pavement Engineering,University of Palermo,Public,Masters,2,EN,LM-23 R,Civil Engineering,http://surpave.eu
Sustainable Architecture and Landscape Design,Polytechnic University of Milan,Public,Masters,2,EN,LM-4 R,Architecture and civil engineering-architecture,https://www.polo-piacenza.polimi.it/
Sustainable chemistry and technologies for circular economy,University of Padua,Public,Masters,2,EN,LM-71 R,Industrial Chemistry Sciences and Technologies,https://www.unipd.it/offerta-didattica/corso-di-laurea-magistrale/scienze?tipo=LM&scuola=SC&ordinamento=2025&key=SC3009&cg=scienze
Sustainable food systems,University of Naples Federico II,Public,Masters,2,EN,LM-70 R,Food Science and Technology,https://www.agraria.unina.it/lauree-magistrali/sustainable-food-systems
Sustainable industrial chemistry,University of Milan,Public,Masters,2,EN,LM-71 R,Industrial Chemistry Sciences and Technologies,https://sic.cdl.unimi.it/en
Sustainable Industrial Engineering,University of Modena and Reggio Emilia,Public,Masters,2,EN,LM-33,Mechanical Engineering,https://www.ingmo.unimore.it/it/didattica/corsi-di-laurea-magistrale-informazioni-generali/sustainable-industrial-engineering-sede
Sustainable Industrial Pharmaceutical Biotechnology,University of Siena,Public,Masters,2,EN,LM-8 R,Industrial biotechnology,https://sustainable-biotechnology.unisi.it/en
Sustainable natural resource management,University of Milan,Public,Masters,2,EN,LM-73 R,Forestry and environmental sciences and technologies,https://snrm.cdl.unimi.it/en
Sustainable polymer and process chemistry,University of Genoa,Public,Masters,2,EN,LM-71 R,Industrial Chemistry Sciences and Technologies,https://corsi.unige.it/en/corsi/11950
"Sustainable Territorial Development  Climate Change, diversity, cooperation",University of Padua,Public,Masters,2,EN,LM-81 R,Sciences for Development Cooperation,https://www.unipd.it/offerta-didattica/corso-di-laurea-magistrale/ingegneria?tipo=LM&scuola=IN&ordinamento=2025&key=IN2941&cg=scienze
"Techniques, Heritage, Industrial Landscapes",University of Padua,Public,Masters,2,EN,LM-84 R,Historical sciences,https://www.unipd.it/offerta-didattica/corso-di-laurea-magistrale/scienze-umane-sociali-e-del-patrimonio-culturale?ordinamento=2025&key=SU3043&tipo=LM&scuola=SU
Digital Heritage,University of Salento,Public,Masters,2,EN,LM-43 R,Computer Methodologies for the Humanities,
Telecommunication Engineering,Polytechnic University of Milan,Public,Masters,2,EN,LM-27,Telecommunications Engineering,https://www.ccstlc.polimi.it/
Telecommunication Engineering,"University of Rome ""La Sapienza""",Public,Masters,2,EN,LM-27,Telecommunications Engineering,https://corsidilaurea.uniroma1.it/it/course/33510
"Telecommunication Engineering: Smart Sensing, Computing and Networking",University of Calabria,Public,Masters,2,EN,LM-27,Telecommunications Engineering,https://www.unical.it/storage/cds/18744/
Telecommunications and Internet Technologies Engineering,Polytechnic University of Bari,Public,Masters,2,EN,LM-27,Telecommunications Engineering,https://poliba.coursecatalogue.cineca.it/corsi/2025/10267
Telecommunications Engineering,University of Cassino and Southern Lazio,Public,Masters,2,EN,LM-27,Telecommunications Engineering,https://www.unicas.it/telecommunications-engineering
Telecommunications Engineering: Advanced Technologies and Services,University of L'Aquila,Public,Masters,2,EN,LM-27,Telecommunications Engineering,https://www.disim.univaq.it/degree.php?section=single-0A01&degree_id=7
"The Ancient Mediterranean World. History, Archaeology and Art",University of Pavia,Public,Masters,2,EN,LM-2 R,Archeology,https://ancientmediterraneanworld.cdl.unipv.it/en
Tourism Economics and Management,Alma Mater Studiorum - University of Bologna,Public,Masters,2,EN,LM-56 R,Economic Sciences,http://corsi.unibo.it/2Cycle/team
Tourism Management and Sustainability,Ca' Foscari University of Venice,Public,Masters,2,EN,LM-49 R,Planning and management of tourism systems,http://www.unive.it/cdl/emr9
Tourism systems and hospitality management,University of Palermo,Public,Masters,2,EN,LM-49 R,Planning and management of tourism systems,http://www.unipa.it/dipartimenti/seas/cds/tourismsystemsandhospitalitymanagement2205
Transport Systems Engineering,"University of Rome ""La Sapienza""",Public,Masters,2,EN,LM-23 R,Civil Engineering,https://corsidilaurea.uniroma1.it/it/course/33488
TRANSPORTATION ENGINEERING AND MOBILITY,University of Naples Federico II,Public,Masters,2,EN,LM-23 R,Civil Engineering,https://transpeng.unina.it
Tropical and Subtropical Agriculture,University of Florence,Public,Masters,2,EN,LM-69 R,Agricultural sciences and technologies,http://www.tropicalagriculture.unifi.it
Urban Planning and Policy Design,Polytechnic University of Milan,Public,Masters,2,EN,LM-48 R,"Urban, territorial and environmental planning",http://www.uppd.polimi.it
Valorization and Sustainable Development of Mountain Areas,University of Milan,Public,Masters,2,EN,LM-73 R,Forestry and environmental sciences and technologies,https://mountainside.cdl.unimi.it/en
"Viticulture, enology and wine marketing",University of Verona,Public,Masters,2,EN,LM-69 R,Agricultural sciences and technologies,https://www.corsi.univr.it/?ent=cs&id=1362
Volcanology,University of Naples Federico II,Public,Masters,2,EN,LM-74 R,Geological sciences and technologies,http://www.distar.unina.it/it/
Water and geological risk engineering,University of Padua,Public,Masters,2,EN,LM-35 R,Environmental and Territorial Engineering,https://www.unipd.it/offerta-didattica/corso-di-laurea-magistrale/ingegneria?tipo=LM&scuola=IN&ordinamento=2025&key=IN2935&cg=ingegneria
"Wildlife Management, Conservation, and Control",University of Sassari,Public,Masters,2,EN,LM-86 R,Zootechnical sciences and animal technologies,https://www.veterinaria.uniss.it/en/didactics/masters-degree-wildlife-management-conservation-and-control-wmcc
"Work, organizational and personnel psychology",Alma Mater Studiorum - University of Bologna,Public,Masters,2,EN,LM-51 R,Psychology,https://corsi.unibo.it/2cycle/OrganizationalPsychology
World Politics and International Relations,University of Pavia,Public,Masters,2,EN,LM-62 R,Political Sciences,https://wpir.cdl.unipv.it
Yacht Design,University of Genoa,Public,Masters,2,EN,LM-34,Naval engineering,https://corsi.unige.it/en/corsi/11958
BA in Politics: Philosophy and Economics,LUISS Guido Carli,Private,Bachelors,3,EN,,Business,
Bachelors in Business Administration,LUISS Guido Carli,Private,Bachelors,3,EN,,Business,
Bachelors in Economics and Business,LUISS Guido Carli,Private,Bachelors,3,EN,,"Management, Finance",
Bachelors in Global Law,LUISS Guido Carli,Private,Bachelors,3,EN,,Global Law and Business,
Bachelors in Management and Artificial Intelligence,LUISS Guido Carli,Private,Bachelors,3,EN,,"Management, Technologies",
Masters in Data Science and Management,LUISS Guido Carli,Private,Masters,2,EN,,"Management, Technologies",
Masters in Finance,LUISS Guido Carli,Private,Masters,2,EN,,Finance,
Masters in Global Management and Politics,LUISS Guido Carli,Private,Masters,2,EN,,"Management, Politics",
Masters in International Relations,LUISS Guido Carli,Private,Masters,2,EN,,"Security , Mediterranean Governance , Diplomacy",
Masters in Management,LUISS Guido Carli,Private,Masters,2,EN,,"Entrepreneurship and Innovation , International Management ,Luxury, Fashion and Made in Italy",
Masters in Strategic Management,LUISS Guido Carli,Private,Masters,2,EN,,"Business Model Innovation, Emerging and Clean Technologies, Circular Economy & SDGs Transformations",
MSc in Marketing,LUISS Guido Carli,Private,Masters,2,EN,,"Market Relationship & Customer Engagement , Marketing Analytics & Metrics",
International MBA (E-Learning),Guglielmo Marconi University,Private,Masters,1,EN,,Business,
Master in Digital Marketing (E-Learning),Guglielmo Marconi University,Private,Masters,1,EN,,Digital Marketing,
"Master in Educational Leadership, Management and Emerging Technologies (E-Learning)",Guglielmo Marconi University,Private,Masters,1,EN,,"Management, Technologies",
Master in Export Management and International Trade (E-Learning),Guglielmo Marconi University,Private,Masters,1,EN,,Management,
Master in Fashion & Luxury MBA (E-Learning),Guglielmo Marconi University,Private,Masters,1,EN,,Fashion,
Master in Fashion Management and Design (E-Learning),Guglielmo Marconi University,Private,Masters,1,EN,,Fashion,
Master in Human Resources Management (E-Learning),Guglielmo Marconi University,Private,Masters,1,EN,,Management,
Master in Interior Design (E-Learning),Guglielmo Marconi University,Private,Masters,1,EN,,Design,
Master in Risk Management (E-Learning),Guglielmo Marconi University,Private,Masters,1,EN,,Management,
BA (Hons) in Fashion Design and Accessories (womenswear / menswear) (Firenze),Marangoni Institute,Private,Bachelors,3,EN,,Fashion,
BA (Hons) in Fashion Design and Accessories (womenswear /menswear ) (Milano),Marangoni Institute,Private,Bachelors,3,EN,,Fashion,
BA (Hons) in Fashion Product (Firenze),Marangoni Institute,Private,Bachelors,3,EN,,Fashion,
BA (Hons) in Fashion Product (Milano),Marangoni Institute,Private,Bachelors,3,EN,,Fashion,
BA (Hons) in Fashion Styling & Creative Direction (Firenze),Marangoni Institute,Private,Bachelors,3,EN,,Fashion,
BA (Hons) in Fashion Styling & Creative Direction (Milano),Marangoni Institute,Private,Bachelors,3,EN,,Fashion,
BA (Hons) in Fragrances & Cosmetics Product and Communication,Marangoni Institute,Private,Bachelors,3,EN,,"Comstics, Fragrances",
BA (Hons) in Interior Design/ Interiors (Milano),Marangoni Institute,Private,Bachelors,3,EN,,Design,
BA (Hons) in Multimedia Arts (Firenze),Marangoni Institute,Private,Bachelors,3,EN,,Multimedia Arts,
BA (Hons) in Product Design/ Design for Products (Milano),Marangoni Institute,Private,Bachelors,3,EN,,Product Design,
BA (Hons) in Visual Design (Milano),Marangoni Institute,Private,Bachelors,3,EN,,Visual Design,
Bachelor in Arts Curating (Firenze),Marangoni Institute,Private,Bachelors,3,EN,,Arts,
Bachelor in Fashion Business & Digital Marketing Intensive,Marangoni Institute,Private,Bachelors,1,EN,,Fashion,
Bachelor in Fashion Design Intensive,Marangoni Institute,Private,Bachelors,1,EN,,Fashion,
Bachelor in Fashion Management & Brand Strategies (Firenze),Marangoni Institute,Private,Bachelors,3,EN,,Fashion,
Bachelor in Fashion Management & Brand Strategies (Milano),Marangoni Institute,Private,Bachelors,3,EN,,Fashion,
"Bachelor in Fashion Management, Digital Communication & Media (Firenze)",Marangoni Institute,Private,Bachelors,3,EN,,Fashion,
"Bachelor in Fashion Management, Digital Communication & Media (Milano)",Marangoni Institute,Private,Bachelors,3,EN,,Fashion,
Bachelor in Fashion Styling & Multimedia Intensive,Marangoni Institute,Private,Bachelors,1,EN,,Fashion,
Bachelor in Interior Design Intensive,Marangoni Institute,Private,Bachelors,1,EN,,Design,
Bachelor in Shoes and Accessories Design Intensive,Marangoni Institute,Private,Bachelors,1,EN,,Design,
Fashion Design: From Inspiration to Creation - 3 Week Course,Marangoni Institute,Private,Short-term/Summer Programs,0,EN,,,
Master in Art Management (Firenze),Marangoni Institute,Private,Masters,9 Months,EN,,Arts,
Master in Communication Design (Milano),Marangoni Institute,Private,Masters,2,EN,,Communication Design,
Master in Contemporary Interior Design/ Interior Design (Milano),Marangoni Institute,Private,Masters,9 Months,EN,,Design,
Master in Creative Digital Media (Firenze),Marangoni Institute,Private,Masters,9 Months,EN,,Digital Media,
Master in Curating Art & Fashion (Firenze),Marangoni Institute,Private,Masters,9 Months,EN,,Fashion,
Master in Design for Gaming & Virtual Reality (Milano),Marangoni Institute,Private,Masters,9 Months,EN,,"Gaming, Virtual Reality",
Master in Design Management & Strategic Innovation (Milano),Marangoni Institute,Private,Masters,9 Months,EN,,"Management, Strategic Innovation",
Master in Digital Art Direction (Milano),Marangoni Institute,Private,Masters,9 Months,EN,,Digital Art,
Master in Digital Design for Immersive Experiences (Milano),Marangoni Institute,Private,Masters,9 Months,EN,,Digital Design,
Master in Fashion & Luxury Brand Management (Firenze),Marangoni Institute,Private,Masters,9 Months,EN,,Fashion,
Master in Fashion & Luxury Brand Management (Milano),Marangoni Institute,Private,Masters,9 Months,EN,,Fashion,
Master in Fashion Buying & Merchandising (Firenze),Marangoni Institute,Private,Masters,9 Months,EN,,Fashion,
Master in Fashion Buying & Merchandising (Milano),Marangoni Institute,Private,Masters,9 Months,EN,,Fashion,
Master in Fashion Design & Innovation (Milano),Marangoni Institute,Private,Masters,2,EN,,Fashion,
Master in Fashion Design (Womenswear / Menswear / Kidswear) (Firenze),Marangoni Institute,Private,Masters,9 Months,EN,,Fashion,
Master in Fashion Design (Womenswear / Menswear) (Milano),Marangoni Institute,Private,Masters,9 Months,EN,,Fashion,
Master in Fashion Luxury & Brand Management for Hospitality (Milano),Marangoni Institute,Private,Masters,9 Months,EN,,Fashion,
Master in Fashion Omnichannel & E-Commerce (Milano),Marangoni Institute,Private,Masters,9 Months,EN,,Fashion,
Master in Fashion Product Management (Milano),Marangoni Institute,Private,Masters,9 Months,EN,,Fashion,
"Master in Fashion Promotion, Communication & Digital Media (Milano)",Marangoni Institute,Private,Masters,9 Months,EN,,Fashion,
Master in Fashion Start-Up (Milano),Marangoni Institute,Private,Masters,9 Months,EN,,Fashion,
"Master in Fashion Styling, Creative Direction & Digital Content (Firenze)",Marangoni Institute,Private,Masters,9 Months,EN,,Fashion,
"Master in Fashion Styling, Creative Direction & Digital Content (Milano)",Marangoni Institute,Private,Masters,9 Months,EN,,Fashion,
"Master in Fashion, Art & Textile Innovation (Firenze)",Marangoni Institute,Private,Masters,9 Months,EN,,Fashion,
Master in Fine Jewellery Design (Milano),Marangoni Institute,Private,Masters,9 Months,EN,,Jewellery Design,
Master in Fragrances and Cosmetics Brand Management and Licensing (Milano),Marangoni Institute,Private,Masters,9 Months,EN,,"Cosmetics, Fragrances",
Master in Interior Contract Design (Milano),Marangoni Institute,Private,Masters,9 Months,EN,,Design,
Master in Luxury Accessories Design & Management (Firenze),Marangoni Institute,Private,Masters,9 Months,EN,,Design,
Master in Luxury Boutique Hotel Interior Design (Milano),Marangoni Institute,Private,Masters,1,EN,,Design,
Master in Marketing and Communication Management for Fragrances & Cosmetics (Milano),Marangoni Institute,Private,Masters,9 Months,EN,,"Cosmetics, Fragrances",
Master in Olfactory Experience Management for the Luxury Industry (Firenze),Marangoni Institute,Private,Masters,9 Months,EN,,Management,
Master in Product & Furniture Design (Milano),Marangoni Institute,Private,Masters,9 Months,EN,,Design,
Master in Product Design for Human-Robot Interaction (Milano),Marangoni Institute,Private,Masters,9 Months,EN,,Technologies,
Bachelor of Arts in Comics & Visual Storytelling,NABA-New Academy of Fine Arts,Private,Bachelors,3,EN,,Arts,
Bachelor of Arts in Creative Technologies,NABA-New Academy of Fine Arts,Private,Bachelors,3,EN,,"VFX & 3D, Game",
Bachelor of Arts in Design,NABA-New Academy of Fine Arts,Private,Bachelors,3,EN,,"Product Design, Interior Design",
Bachelor of Arts in Fashion Design,NABA-New Academy of Fine Arts,Private,Bachelors,3,EN,,"Fashion Design Management, Fashion Design, Fashion Styling and Communication",
Bachelor of Arts in Fashion Marketing Management,NABA-New Academy of Fine Arts,Private,Bachelors,3,EN,,Fashion,
Bachelor of Arts in Film and Animation,NABA-New Academy of Fine Arts,Private,Bachelors,3,EN,,"Film making, Animation",
Bachelor of Arts in Graphic Design and Art Direction,NABA-New Academy of Fine Arts,Private,Bachelors,3,EN,,"Brand Design, Creative Direction, Visual Design",
Bachelor of Arts in Marketing & Management for Creative Business,NABA-New Academy of Fine Arts,Private,Bachelors,3,EN,,,
Bachelor of Arts in Painting and Visual Arts,NABA-New Academy of Fine Arts,Private,Bachelors,3,EN,,"Painting, Visual Arts",
Bachelor of Arts in Set Design,NABA-New Academy of Fine Arts,Private,Bachelors,3,EN,,"Theatre and Opera, Media and Events",
Master in Art and Ecology,NABA-New Academy of Fine Arts,Private,Masters,1,EN,,Arts,
Master in Contemporary Art Markets,NABA-New Academy of Fine Arts,Private,Masters,1,EN,,Arts,
Master in Creative Advertising,NABA-New Academy of Fine Arts,Private,Masters,1,EN,,Digital,
Master in Fashion Digital Marketing,NABA-New Academy of Fine Arts,Private,Masters,1,EN,,Digital,
Master in Interior and Living Design,NABA-New Academy of Fine Arts,Private,Masters,1,EN,,Design,
Master in Italian Design,NABA-New Academy of Fine Arts,Private,Masters,1,EN,,Design,
Master in Photography and Visual Design,NABA-New Academy of Fine Arts,Private,Masters,1,EN,,"Photography, Design",
Master in Screenwriting for Series,NABA-New Academy of Fine Arts,Private,Masters,1,EN,,Screenwriting,
Master in Sneaker Design,NABA-New Academy of Fine Arts,Private,Masters,1,EN,,Design,
Master in Sustainable Innovation Communication,NABA-New Academy of Fine Arts,Private,Masters,1,EN,,Commucnication,
Master of Arts in Creative Media Production,NABA-New Academy of Fine Arts,Private,Masters,2,EN,,"Arts, Production",
Master of Arts in Digital & Live Performance,NABA-New Academy of Fine Arts,Private,Masters,2,EN,,"Digital, Arts",
Master of Arts in Fashion and Costume Design,NABA-New Academy of Fine Arts,Private,Masters,2,EN,,Fashion,
Master of Arts in Fashion Design,NABA-New Academy of Fine Arts,Private,Masters,2,EN,,,
Master of Arts in Interior Design,NABA-New Academy of Fine Arts,Private,Masters,2,EN,,,
Master of Arts in Luxury Brand Management,NABA-New Academy of Fine Arts,Private,Masters,1,EN,,,
Master of Arts in Product and Service Design,NABA-New Academy of Fine Arts,Private,Masters,2,EN,,,
Master of Arts in Social Design,NABA-New Academy of Fine Arts,Private,Masters,2,EN,,,
Master of Arts in Textile Design,NABA-New Academy of Fine Arts,Private,Masters,2,EN,,,
Master of Arts in User Experience Design,NABA-New Academy of Fine Arts,Private,Masters,2,EN,,,
Master of Arts in Visual Arts and Curatorial Studies,NABA-New Academy of Fine Arts,Private,Masters,2,EN,,,
Master of Arts in Visual Design and Integrated Marketing Communication,NABA-New Academy of Fine Arts,Private,Masters,2,EN,,,
BA in Design - Interior Design & Urban Vision,DOMUS Academy,Private,Bachelors,3,EN,,,
BA in Design - Product Design & Value,DOMUS Academy,Private,Bachelors,3,EN,,,
BA in Design - UX Design,DOMUS Academy,Private,Bachelors,3,EN,,,
BA in Fashion Design - Fashion & Luxury Management,DOMUS Academy,Private,Bachelors,3,EN,,,
BA in Fashion Design - Fashion Product Development,DOMUS Academy,Private,Bachelors,3,EN,,,
BA in Fashion Design - Textile & Accessory Design,DOMUS Academy,Private,Bachelors,3,EN,,,
MA in Design Innovation,DOMUS Academy,Private,Masters,2,EN,,,
MA in Design Leadership & Strategy,DOMUS Academy,Private,Masters,2,EN,,,
"MA in Fashion: Design, Art & Technology",DOMUS Academy,Private,Masters,2,EN,,,
Master in Interaction Design,DOMUS Academy,Private,Masters,11 Months,EN,,,
Master in Business Design,DOMUS Academy,Private,Masters,11 Months,EN,,,
Master in Design Futures,DOMUS Academy,Private,Masters,11 Months,EN,,,
Master in Design x AI,DOMUS Academy,Private,Masters,11 Months,EN,,,
Master in Fashion Design,DOMUS Academy,Private,Masters,11 Months,EN,,,
Master in Fashion Management,DOMUS Academy,Private,Masters,11 Months,EN,,,
Master in Fashion Styling and Visual Merchandising,DOMUS Academy,Private,Masters,11 Months,EN,,,
Master in Interior and Living Design,DOMUS Academy,Private,Masters,11 Months,EN,,,
Master in Interior and Living Design (Dual Degree),DOMUS Academy,Private,Masters,1.2,EN,,,
Master in Luxury Brand Management,DOMUS Academy,Private,Masters,11 Months,EN,,,
Master in Product Design,DOMUS Academy,Private,Masters,11 Months,EN,,,
Master in Service Design,DOMUS Academy,Private,Masters,11 Months,EN,,,
Master in Urban Vision and Architectural Design,DOMUS Academy,Private,Masters,11 Months,EN,,,
Master in Visual Brand Design,DOMUS Academy,Private,Masters,11 Months,EN,,,
BA in Fine Arts - Art History,"Marist University, Florence",Private,Bachelors,4,EN,,,
BA in Fine Arts - Studio Art,"Marist University, Florence",Private,Bachelors,4,EN,,,
BA in Italian Language,"Marist University, Florence",Private,Bachelors,4,EN,,,
Bachelor in Communication Design,European Institute of Design - IED,Private,Bachelors,3,EN,,,
Bachelor in Fashion Design (Florence),European Institute of Design - IED,Private,Bachelors,3,EN,,,
Bachelor in Fashion Design (Milan),European Institute of Design - IED,Private,Bachelors,3,EN,,,
Bachelor in Fashion Marketing and Communication (Florence),European Institute of Design - IED,Private,Bachelors,3,EN,,,
Bachelor in Fashion Marketing and Communication (Milan),European Institute of Design - IED,Private,Bachelors,3,EN,,,
Bachelor in Fashion Stylist (Florence),European Institute of Design - IED,Private,Bachelors,3,EN,,,
Bachelor in Fashion Stylist (Milan),European Institute of Design - IED,Private,Bachelors,3,EN,,,
Bachelor in Graphic Design (Milan),European Institute of Design - IED,Private,Bachelors,3,EN,,,
Bachelor in Graphic Design - Motion Graphics (Rome),European Institute of Design - IED,Private,Bachelors,3,EN,,,
Bachelor in Illustration,European Institute of Design - IED,Private,Bachelors,3,EN,,,
Bachelor in Interior & Furniture Design (Florence),European Institute of Design - IED,Private,Bachelors,3,EN,,,
Bachelor in Interior and Furniture Design,European Institute of Design - IED,Private,Bachelors,3,EN,,,
Bachelor in Interior Design (Florence),European Institute of Design - IED,Private,Bachelors,3,EN,,,
Bachelor in Interior Design (Milan),European Institute of Design - IED,Private,Bachelors,3,EN,,,
Bachelor in Interior Design (Rome),European Institute of Design - IED,Private,Bachelors,3,EN,,,
Bachelor in Jewellery Design,European Institute of Design - IED,Private,Bachelors,3,EN,,,
Bachelor in Photography,European Institute of Design - IED,Private,Bachelors,3,EN,,,
Bachelor in Product Design,European Institute of Design - IED,Private,Bachelors,3,EN,,,
Bachelor in Transportation Design,European Institute of Design - IED,Private,Bachelors,3,EN,,,
Bachelor of Fine Arts in Interior Design,"Marist University, Florence",Private,Bachelors,4,EN,,,
Bachelors in Fashion Design,Raffles Milano Institute of Fashion and Design,Private,Bachelors,3,EN,,,
Bachelors in Interior Design,Raffles Milano Institute of Fashion and Design,Private,Bachelors,3,EN,,,
Bachelors in Product Design,Raffles Milano Institute of Fashion and Design,Private,Bachelors,3,EN,,,
Bachelors in Visual Design,Raffles Milano Institute of Fashion and Design,Private,Bachelors,3,EN,,,
BSc in Conservation Studies,"Marist University, Florence",Private,Bachelors,4,EN,,,
BSc in Digital Media,"Marist University, Florence",Private,Bachelors,4,EN,,,
BSc in Fashion Merchandising,"Marist University, Florence",Private,Bachelors,4,EN,,,
BSc in Global Marketing Communication,"Marist University, Florence",Private,Bachelors,4,EN,,,
BSc in Studio Arts,"Marist University, Florence",Private,Bachelors,4,EN,,,
International Full-Time MBA,Polimi Graduate School of Management,Private,Masters,1,EN,,,
International Master in Digital Innovation and New Business Design,Polimi Graduate School of Management,Private,Masters,1,EN,,,
International Master in Environmental Sustainability and Circular Economy,Polimi Graduate School of Management,Private,Masters,1,EN,,,
International Master in Financial Risk Management,Polimi Graduate School of Management,Private,Masters,1,EN,,,
International Master in Healthcare & Life Sciences Innovation and Management,Polimi Graduate School of Management,Private,Masters,1,EN,,,
International Master In Innovation And Entrepreneurship,Polimi Graduate School of Management,Private,Masters,1,EN,,,
International Master In Luxury Management,Polimi Graduate School of Management,Private,Masters,1.3,EN,,,
"International Master in Marketing Management, Omnichannel & Consumer Analytics",Polimi Graduate School of Management,Private,Masters,1,EN,,,
International Master in Media and Communication Management,Polimi Graduate School of Management,Private,Masters,1,EN,,,
